{
  "$schema": "../HelloAction/plugin.schema.json",
  "schemaVersion": 1,

  "id": "com.example.floatingball",
  "name": "悬浮球",
  "description": "在屏幕上放一颗常驻悬浮球：点它呼出你自己的轮盘，选哪个扇区执行哪个。拖动改位置，右键收起。球由插件画，轮盘整体归宿主 —— 外观、扇区、体积、多屏 DPI 永远和你配的那一套一致。",
  "author": "StarPie Community",
  "homepage": "https://github.com/SoftBlack42/StarPie",
  "license": "MIT",
  "version": "1.0.0",

  "apiVersion": "1.6",
  "minHostVersion": "1.8.0",

  "targetFramework": "net8.0-windows",
  "platform": "win-x64",

  "assembly": "StarPie.Plugin.FloatingBall.dll",
  "entryType": "StarPie.Plugin.FloatingBall.FloatingBallPlugin",

  "capabilities": ["Ui", "Wheel"],

  "contributions": {
    "actions": true,
    "icons": true,
    "i18n": true
  },

  "tags": ["悬浮球", "轮盘", "常驻", "快捷入口", "示例"]
}
